{
  "DocumentId": "uploads/b2c3d4e5/employee_lunch_menu.pdf",
  "Status": "COMPLETED",
  "scoring_version": "2.0",
  "overall_score": null,
  "OverallScore": null,
  "Score": null,
  "GdprScore": null,
  "Soc2Score": null,
  "CcpaScore": null,
  "Iso27701Score": null,
  "frameworks": {
    "gdpr": {
      "score": null,
      "status": "UNSCORED",
      "summary": "Document type not recognised (supported: privacy_notice, dpa, security_policy).",
      "rationale": "Document type not recognised (supported: privacy_notice, dpa, security_policy).",
      "counts": {},
      "critical_gaps": [],
      "coverage_pct": null,
      "disclosure_only": false,
      "unverifiable": []
    },
    "soc2": {
      "score": null,
      "status": "UNSCORED",
      "summary": "Document type not recognised (supported: privacy_notice, dpa, security_policy).",
      "rationale": "Document type not recognised (supported: privacy_notice, dpa, security_policy).",
      "counts": {},
      "critical_gaps": [],
      "coverage_pct": null,
      "disclosure_only": false,
      "unverifiable": []
    },
    "ccpa": {
      "score": null,
      "status": "UNSCORED",
      "summary": "Document type not recognised (supported: privacy_notice, dpa, security_policy).",
      "rationale": "Document type not recognised (supported: privacy_notice, dpa, security_policy).",
      "counts": {},
      "critical_gaps": [],
      "coverage_pct": null,
      "disclosure_only": false,
      "unverifiable": []
    },
    "iso27701": {
      "score": null,
      "status": "UNSCORED",
      "summary": "Document type not recognised (supported: privacy_notice, dpa, security_policy).",
      "rationale": "Document type not recognised (supported: privacy_notice, dpa, security_policy).",
      "counts": {},
      "critical_gaps": [],
      "coverage_pct": null,
      "disclosure_only": false,
      "unverifiable": []
    }
  },
  "items": [],
  "risks": [],
  "forward_looking": [],
  "placeholders": [],
  "meta": {
    "scoring_version": "2.0",
    "as_of": "2026-10-05",
    "doc_types": [],
    "classification": [{"document": "employee_lunch_menu.pdf", "types": [], "score": 0}],
    "soc2_mode": "penalize",
    "thresholds": {"compliant_min": 85, "review_min": 60},
    "llm_tier": "free",
    "unscored_reason": "Document type not recognised (supported: privacy_notice, dpa, security_policy)."
  }
}

